{
  "planName": "运动健康处方",
  "planTitle": "个体化运动管理：降糖控压、减重护血管",
  "planSummary": "本方案针对您2型糖尿病合并高血压、高脂血症、周围血管病变及肥胖的情况，围绕餐后血糖控制、血压平稳、减重及血管保护设计。重点包括餐后短时步行降低餐后高血糖、利用碎片时间进行低至中等强度有氧运动、结合抗阻训练增强肌肉量以改善胰岛素敏感性，以及运动前后血糖监测和足部护理，帮助您逐步建立可持续的运动习惯，改善代谢指标。",
  "executionPoints": "优先执行餐后步行（如晚餐后15-20分钟开始步行10-15分钟）和利用零散时间进行短时活动；运动前后务必测量血糖，避免在血糖过高（>13.9mmol/L）或过低（<5.6mmol/L）时运动；运动时穿舒适鞋袜，注意足部感觉，避免高冲击活动；如出现胸闷、头晕、明显乏力、足部疼痛或异常，应立即停止运动并联系医生或健管师；每周记录运动类型、时长、血糖及血压变化，以便调整方案。",
  "groups": [
    {
      "groupTitle": "运动总原则",
      "groupType": "adviceList",
      "groupSummary": "明确运动目标（控糖、减重、降压）、安全边界和执行节奏。",
      "displayStyle": "list",
      "dietPlanGoalLabel": "",
      "goalBasis": "",
      "items": [
        {
          "itemType": "advice",
          "day": "",
          "title": "运动目标",
          "content": "每周累计至少150分钟中等强度有氧运动，配合2-3次抗阻训练，帮助控制血糖、减轻体重、改善血压。",
          "focusPoint": "当前晚餐后血糖极高（19.5mmol/L），运动是辅助降糖的重要手段，但需避开血糖过高（>16.7mmol/L）或过低（<3.9mmol/L）时段。",
          "importance": "重点执行",
          "dailyTotalKcal": "",
          "dailyTotalProteinG": "",
          "dailyTotalFatG": "",
          "estimatedEnergyDeficitKcal": "",
          "meals": []
        },
        {
          "itemType": "advice",
          "day": "",
          "title": "安全第一",
          "content": "运动前测血糖、量血压；运动中若出现胸闷、头晕、明显乏力、足部疼痛，立即停止并联系医生。",
          "focusPoint": "血压曾有150/100mmHg，虽随访平稳仍需警惕；合并周围血管病变，注意足部感觉和皮肤状况，避免高冲击活动。",
          "importance": "重点执行",
          "dailyTotalKcal": "",
          "dailyTotalProteinG": "",
          "dailyTotalFatG": "",
          "estimatedEnergyDeficitKcal": "",
          "meals": []
        },
        {
          "itemType": "advice",
          "day": "",
          "title": "循序渐进",
          "content": "从低强度（如慢走）开始，每1-2周适当增加时长或强度，避免突然大量运动。",
          "focusPoint": "近一年运动频率低（每周1次），需逐步适应，防止受伤或过度疲劳。",
          "importance": "常规建议",
          "dailyTotalKcal": "",
          "dailyTotalProteinG": "",
          "dailyTotalFatG": "",
          "estimatedEnergyDeficitKcal": "",
          "meals": []
        }
      ]
    },
    {
      "groupTitle": "有氧运动安排",
      "groupType": "adviceList",
      "groupSummary": "从低到中等强度有氧运动开始，逐步改善血糖和体重管理。",
      "displayStyle": "list",
      "dietPlanGoalLabel": "",
      "goalBasis": "",
      "items": [
        {
          "itemType": "advice",
          "day": "",
          "title": "饭后快走",
          "content": "每周安排5天，每次餐后1小时快走或慢走15-20分钟，累计每天30分钟以上。",
          "focusPoint": "餐后血糖极高（19.5mmol/L），饭后步行可显著降低餐后血糖峰值；注意避开血糖>16.7mmol/L时运动，可先测血糖再决定。",
          "importance": "重点执行",
          "dailyTotalKcal": "",
          "dailyTotalProteinG": "",
          "dailyTotalFatG": "",
          "estimatedEnergyDeficitKcal": "",
          "meals": []
        },
        {
          "itemType": "advice",
          "day": "",
          "title": "碎片化有氧",
          "content": "利用工间休息、等车、接电话等零散时间，每次快走或原地踏步5-10分钟，累计每天总时长。",
          "focusPoint": "适合夜班多、整块时间少的现状；每次短时活动也能累积降糖效果。",
          "importance": "常规建议",
          "dailyTotalKcal": "",
          "dailyTotalProteinG": "",
          "dailyTotalFatG": "",
          "estimatedEnergyDeficitKcal": "",
          "meals": []
        },
        {
          "itemType": "advice",
          "day": "",
          "title": "周末延长活动",
          "content": "周末选一天进行连续30-45分钟的步行或慢跑，心率控制在（220-年龄）×60%~70%。",
          "focusPoint": "当前步数约3000步，逐渐增加步数至6000-8000步/天；慢跑需注意足部保护，穿合适跑鞋。",
          "importance": "补充建议",
          "dailyTotalKcal": "",
          "dailyTotalProteinG": "",
          "dailyTotalFatG": "",
          "estimatedEnergyDeficitKcal": "",
          "meals": []
        }
      ]
    },
    {
      "groupTitle": "抗阻训练安排",
      "groupType": "adviceList",
      "groupSummary": "从低负荷动作开始，每周2-3次，增强肌肉量和胰岛素敏感性。",
      "displayStyle": "list",
      "dietPlanGoalLabel": "",
      "goalBasis": "",
      "items": [
        {
          "itemType": "advice",
          "day": "",
          "title": "居家抗阻基础动作",
          "content": "每周非连续2-3天，完成靠墙静蹲（每次30秒-1分钟）、坐姿抬腿（每侧10-15次）、弹力带划船（10-15次），每个动作2-3组。",
          "focusPoint": "动作过程中保持呼吸，避免憋气导致血压骤升；如有弹力带可从低阻力开始。",
          "importance": "重点执行",
          "dailyTotalKcal": "",
          "dailyTotalProteinG": "",
          "dailyTotalFatG": "",
          "estimatedEnergyDeficitKcal": "",
          "meals": []
        },
        {
          "itemType": "advice",
          "day": "",
          "title": "上肢力量训练",
          "content": "使用小哑铃或弹力带做二头弯举、肩部推举，每组10-12次，共2-3组。",
          "focusPoint": "可穿插在夜班休息时进行，每次5-10分钟即可完成。",
          "importance": "常规建议",
          "dailyTotalKcal": "",
          "dailyTotalProteinG": "",
          "dailyTotalFatG": "",
          "estimatedEnergyDeficitKcal": "",
          "meals": []
        }
      ]
    },
    {
      "groupTitle": "柔韧与平衡训练",
      "groupType": "adviceList",
      "groupSummary": "改善关节灵活性和平衡能力，减少运动损伤风险。",
      "displayStyle": "list",
      "dietPlanGoalLabel": "",
      "goalBasis": "",
      "items": [
        {
          "itemType": "advice",
          "day": "",
          "title": "动态拉伸热身",
          "content": "每次有氧或抗阻训练前，做5分钟动态拉伸（如摆腿、转肩、弓步转体）。",
          "focusPoint": "动态拉伸可提升关节活动度，降低拉伤风险；尤其适合久坐后开始运动。",
          "importance": "常规建议",
          "dailyTotalKcal": "",
          "dailyTotalProteinG": "",
          "dailyTotalFatG": "",
          "estimatedEnergyDeficitKcal": "",
          "meals": []
        },
        {
          "itemType": "advice",
          "day": "",
          "title": "静态拉伸放松",
          "content": "运动后或睡前，做5-10分钟静态拉伸（如大腿后侧、小腿、肩部拉伸），每个动作保持20-30秒。",
          "focusPoint": "有助于放松肌肉、改善睡眠质量；夜班后做可帮助身体恢复。",
          "importance": "常规建议",
          "dailyTotalKcal": "",
          "dailyTotalProteinG": "",
          "dailyTotalFatG": "",
          "estimatedEnergyDeficitKcal": "",
          "meals": []
        },
        {
          "itemType": "advice",
          "day": "",
          "title": "单腿站立平衡",
          "content": "每天1-2次，每次单腿站立30秒，交替进行，手可扶墙。",
          "focusPoint": "改善下肢平衡和本体感觉，预防跌倒；合并周围血管病变时注意足部支撑。",
          "importance": "补充建议",
          "dailyTotalKcal": "",
          "dailyTotalProteinG": "",
          "dailyTotalFatG": "",
          "estimatedEnergyDeficitKcal": "",
          "meals": []
        }
      ]
    },
    {
      "groupTitle": "夜班/碎片化运动策略",
      "groupType": "adviceList",
      "groupSummary": "针对夜班作息和碎片化时间，设计灵活可执行的活动方案。",
      "displayStyle": "list",
      "dietPlanGoalLabel": "",
      "goalBasis": "",
      "items": [
        {
          "itemType": "advice",
          "day": "",
          "title": "夜班小活动",
          "content": "夜班每隔2-3小时起身活动5分钟，如原地踏步、伸展、靠墙静蹲。",
          "focusPoint": "避免长时间久坐导致血糖升高和下肢循环不良；活动前后可少量饮水。",
          "importance": "重点执行",
          "dailyTotalKcal": "",
          "dailyTotalProteinG": "",
          "dailyTotalFatG": "",
          "estimatedEnergyDeficitKcal": "",
          "meals": []
        },
        {
          "itemType": "advice",
          "day": "",
          "title": "下班后低强度放松",
          "content": "夜班回家后先休息30分钟，再慢走15分钟或做一套拉伸，帮助身体过渡到休息状态。",
          "focusPoint": "避免立即高强度运动，防止过度疲劳影响睡眠。",
          "importance": "常规建议",
          "dailyTotalKcal": "",
          "dailyTotalProteinG": "",
          "dailyTotalFatG": "",
          "estimatedEnergyDeficitKcal": "",
          "meals": []
        },
        {
          "itemType": "advice",
          "day": "",
          "title": "利用通勤碎片时间",
          "content": "上下班途中提前一站下车快走，或走楼梯代替电梯。",
          "focusPoint": "每次5-10分钟即可累积有效活动量，且不占用整块时间。",
          "importance": "补充建议",
          "dailyTotalKcal": "",
          "dailyTotalProteinG": "",
          "dailyTotalFatG": "",
          "estimatedEnergyDeficitKcal": "",
          "meals": []
        }
      ]
    },
    {
      "groupTitle": "运动前后监测与安全",
      "groupType": "adviceList",
      "groupSummary": "确保运动安全，预防低血糖、血压异常及足部损伤。",
      "displayStyle": "list",
      "dietPlanGoalLabel": "",
      "goalBasis": "",
      "items": [
        {
          "itemType": "advice",
          "day": "",
          "title": "运动前必测",
          "content": "运动前测血糖，若<5.6mmol/L先补充15克碳水化合物（如半杯果汁）；若>16.7mmol/L暂缓运动。",
          "focusPoint": "服用吡格列酮二甲双胍片，低血糖风险虽低但需警惕；餐后血糖极高时运动可能加重高血糖。",
          "importance": "重点执行",
          "dailyTotalKcal": "",
          "dailyTotalProteinG": "",
          "dailyTotalFatG": "",
          "estimatedEnergyDeficitKcal": "",
          "meals": []
        },
        {
          "itemType": "advice",
          "day": "",
          "title": "运动后检查",
          "content": "运动后测血糖、检查双足有无红肿、破损或水泡。",
          "focusPoint": "周围血管病变可能使足部感觉迟钝，每日自查足部皮肤非常重要。",
          "importance": "重点执行",
          "dailyTotalKcal": "",
          "dailyTotalProteinG": "",
          "dailyTotalFatG": "",
          "estimatedEnergyDeficitKcal": "",
          "meals": []
        },
        {
          "itemType": "advice",
          "day": "",
          "title": "血压监测",
          "content": "运动前后若感到头晕、头痛，及时测量血压；血压>180/110mmHg时暂停运动。",
          "focusPoint": "起床血压150/100mmHg提示血压控制仍需优化，运动强度不宜过高。",
          "importance": "常规建议",
          "dailyTotalKcal": "",
          "dailyTotalProteinG": "",
          "dailyTotalFatG": "",
          "estimatedEnergyDeficitKcal": "",
          "meals": []
        }
      ]
    }
  ]
}